<?xml version="1.0" encoding="UTF-8"?>
<xs:schema attributeFormDefault="unqualified" elementFormDefault="qualified" xmlns:xs="http://www.w3.org/2001/XMLSchema">
  <xs:element name="data" type="dataType"/>
  <xs:complexType name="testDataType">
    <xs:simpleContent>
      <xs:extension base="xs:string">
        <xs:attribute type="xs:string" name="name" use="required">
        <xs:simpleType>
          <xs:restriction base="xs:string">
            <xs:minLength value="3"/>
          </xs:restriction>
        </xs:simpleType>
        </xs:attribute>
      </xs:extension>
    </xs:simpleContent>
  </xs:complexType>
  <xs:complexType name="dataType">
    <xs:sequence>
      <xs:element type="testDataType" name="testData" maxOccurs="unbounded" minOccurs="1"/>
    </xs:sequence>
  </xs:complexType>
</xs:schema>