<data xmlns:xsi="http://www.w3.org/2001/XMLSchema-instance" xsi:noNamespaceSchemaLocation="../../../../../../../main/resources/TestData.xsd">

    <testData name="cityName">Bangalore</testData>
    <testData name="cityNameForPostAd">Mumbai</testData>
    <testData name="localityNameForPostAd">Agripada</testData>
    <testData name="categoryName">Electronics</testData>
    <testData name="categoryValue">Electronics &amp; Appliances</testData>
    <testData name="subCategoryName">laptop</testData>
    <testData name="adTitle">i want to sell Acer laptop</testData>
    <testData name="adDescription">Acer laptop in good condition with charger and it was used only 6 months </testData>
    <testData name="youRTypeName">individual</testData>
    <testData name="conditionTypeName">used</testData>
    <testData name="productTypeName">laptop</testData>
    <testData name="priceAmount">50000</testData>
    <testData name="name">Monu</testData>
    <testData name="emailId">automation.quikr@gmail.com</testData>
    <testData name="mobileNo">9955199187</testData>
    <testData name="incompleteAdTitle">title</testData>
    <testData name="incompleteAdDescription">Post ad</testData>
    <testData name="brandNameOptionForElectronicsCategory">brandNameOptionForElectronicsCategory</testData>
    <testData name="alsoIncludesOptionNameForElectronicsCategory">alsoIncludesOptionNameForElectronicsCategory</testData>
    <testData name="successMsgAfterAdPost">We are reviewing your ad.</testData>
    <testData name="pinCode">560066</testData>
    <testData name="address">Quikr india pvt ltd</testData>
    <testData name="mobile">mobile</testData>

</data>