<?xml version="1.0"?>
<data xmlns:xsi="http://www.w3.org/2001/XMLSchema-instance"
      xsi:noNamespaceSchemaLocation="../../../../../../main/resources/TestData.xsd">

    <testData name="selectedCity">bangalore</testData>
    <testData name="emailId">automation.quikr@gmail.com</testData>
    <testData name="password">quikr1234</testData>
    <testData name="homepage">quikr.com</testData>
    <testData name="mspURL">msp</testData>
    <testData name="category">Cars &amp; Bikes</testData>
    <testData name="subCategory">Bikes &amp; Scooters</testData>
    <testData name="brand">Bajaj</testData>
    <testData name="mobileBrand">Apple</testData>
    <testData name="mobileModel">iPhone 1st Gen 16 GB</testData>
    <testData name="model">Avenger</testData>
    <testData name="year">2011</testData>
    <testData name="mobile">mobile</testData>
    <testData name="validpage">quikr.com</testData>
    <testData name="LaptopsandComputers">Laptops - Computers</testData>
    <testData name="ComputersandPeripherals">Computer Peripherals</testData>
    <testData name="lowestpricesorttype">Lowest Price</testData>
    <testData name="highestpricesorttype">Highest Price</testData>
    <testData name="mostrecentsorttype">Most Recent (default)</testData>
    <testData name="withpicturesorttype">With Picture</testData>
    <testData name="papPage">post-classifieds-ads</testData>
    <testData name="profileName">Test User</testData>
    <testData name="profilePhNum">8558558526</testData>
    <testData name="selectcategoryURL">select-category</testData>
    <testData name="CategoryCarsandBikes">Cars &amp; Bikes</testData>
    <testData name="CategoryMobilesandTablets">Mobiles &amp; Tablets</testData>
    <testData name="SubCategoryMobiles">Mobile Phones</testData>
    <testData name="CategoryElectronics">Electronics &amp; Appliances</testData>
    <testData name="CategoryRealEstate">Real Estate</testData>
    <testData name="CategoryHomeandLifeStyle">Home &amp; Lifestyle</testData>
    <testData name="CategoryJobs">Jobs</testData>
    <testData name="CategoryEntertainment">Entertainment</testData>
    <testData name="CategoryServices">Services</testData>
    <testData name="SubCategoryCars">Cars</testData>
    <testData name="SetAttributesURL">set-attributes</testData>
    <testData name="CategoryServices">Services</testData>
    <testData name="SubCategoryCars">Cars</testData>
    <testData name="SetAttributesURL">set-attributes</testData>
    <testData name="ValidationMsgPrice">Enter Price</testData>
    <testData name="ValidationMsgBrand">Select Brand Name</testData>
    <testData name="ValidationMsgYear">Select Year</testData>
    <testData name="ValidationMsgKms">Enter Kms Driven</testData>
    <testData name="ValidationMsgCity">Please select city</testData>
    <testData name="Price">15000</testData>
    <testData name="Brand">Audi</testData>
    <testData name="Model">A3</testData>
    <testData name="Variant">35 TDI Attraction</testData>
    <testData name="OperatingSystem">Android</testData>
    <testData name="Year">2011</testData>
    <testData name="Kms">16000</testData>
    <testData name="Color">Black</testData>
    <testData name="Fuel">Petrol</testData>
    <testData name="NoOfOwners">One</testData>
    <testData name="Insurancedate">2</testData>
    <testData name="PostAdURL">post-ad</testData>
    <testData name="ValidationMsgAdDescription">Description Should be minimum 8 words</testData>
    <testData name="ValidationMsgAdDescription1">Invalid Email</testData>
    <testData name="AdDescription">Audi 2011 Model Black Color for Sale, Excellent Condition</testData>
    <testData name="MobilesAdDescription">Mobile is in Great Condition, No Scratch, All accessories with Box</testData>
    <testData name="PostAdSuccessfulURL">succeed</testData>
    <testData name="255PremiumPlan">₹ 374</testData>
    <testData name="300PremiumPlan">₹ 499</testData>
    <testData name="450PremiumPlan">₹ 749</testData>
    <testData name="15daysPremiumPlan">15 days</testData>
    <testData name="1monthPremiumPlan">1 month</testData>
    <testData name="60daysPremiumPlan">60 days</testData>
    <testData name="PaymentGatewayURL">select-payment-gateway</testData>
    <testData name="PaymentMode1">Pay via Mobile Billing</testData>
    <testData name="PaymentMode2">Credit Card / Debit Card</testData>
    <testData name="PaymentMode3">Net Banking</testData>
    <testData name="ProdTypeSnbFilter">Desktop</testData>
    <testData name="alertCreationDesc">description</testData>
    <testData name="alertCreationCars">cars</testData>
    <testData name="CardTypeCredit">credit</testData>
    <testData name="CardTypeDebit">debit</testData>
    <testData name="CardNumberCreditAmericanExpress">378282246310005</testData>
    <testData name="NameofHolder">Automation Quikr</testData>
    <testData name="ExpiryDate">07/21</testData>
    <testData name="CVV">690</testData>
    <testData name="BankName">ICICI Bank</testData>
    <testData name="ICICIBankPaymentPage">shopping.icicibank.com</testData>
    <testData name="ChatMessage">Hi are u there?</testData>
    <testData name="PostAdSuccesfull">PostAd/?succeed</testData>
    <testData name="offerPrice">100000</testData>
    <testData name="JunkMail">junkabc@aol.com</testData>
    <testData name="ques">Where is the party Bro!</testData>
    <testData name="NewUICity">Gurgaon</testData>
    <testData name="Address">Testing Address 1234 567 89 []</testData>
    <testData name="pincode">560032</testData>
    <testData name="postAdTextinHindi">विज्ञापन पोस्ट करें</testData>
    <testData name="postAdTextinTamil">இலவச விளம்பரம் செய்</testData>
    <testData name="postAdTextinTelugu">ఉచిత ప్రకటనను పోస్ట్ చేయండి</testData>
    <testData name="postAdTextinMalyalam">സൌജന്യ പരസ്യം നല്കുക</testData>
    <testData name="postAdTextinKannada">ಉಚಿತ ಜಾಹೀರಾತನ್ನು ಪೋಸ್ಟ್ ಮಾಡಿ</testData>
    <testData name="postAdTextinMarathi">जाहिरात पोस्ट करा</testData>
    <testData name="postAdTextinGujarati">મફત જાહેરાત</testData>
    <testData name="MatchingAdsBikes">Bikes-Scooters</testData>
    <testData name="chatName">Testing Name</testData>

</data>
