<data xmlns:xsi="http://www.w3.org/2001/XMLSchema-instance" xsi:noNamespaceSchemaLocation="../../../../../../../main/resources/TestData.xsd">

    <testData name="Appversion">About Quikr</testData>

    <testData name="MyAccount">My Account</testData>
    <testData name="AdTitle">Honda car on sale</testData>
    <testData name="desc">Six months old honda car is on sale</testData>
    <testData name="location">80 Ft. Road</testData>
    <testData name="cars">Cars &amp; Bikes</testData>
    <testData name="car">Cars</testData>
    <testData name="price">500000</testData>
    <testData name="brand">Chevrolet</testData>
    <testData name="model">Beat</testData>
    <testData name="variant">Diesel</testData>
    <testData name="year">2004</testData>
    <testData name="distance">25000</testData>
    <testData name="color">Red</testData>
    <testData name="fuel">Diesel</testData>
    <testData name="owner">One</testData>
    <testData name="name">manav dayal</testData>
    <testData name="email">automation.quikr@gmail.com</testData>
    <testData name="number">9955199187</testData>
    <testData name="PostAd">Post Your Ad</testData>
    <testData name="modelAssertionString">Please select model</testData>
    <testData name="incompleteAdTitle">cars in</testData>
    <testData name="incompleteDesc">Six months old honda</testData>
    <testData name="MyAds">My Ads</testData>
    <testData name="newLocation">Agaram</testData>
    <testData name="save">Save</testData>
    <testData name="Category">Cars</testData>
    <testData name="cranation">CARNATION OVERALL RATING</testData>
    <testData name="bike">Honda</testData>
    <testData name="recentlyViewed">Recently Viewed Ads</testData>
    <testData name="NofikarOptions">Ac/Heater</testData>
    <testData name="priceField">Enter Price</testData>
    <testData name="KiloMeter">Kms Driven</testData>
    <testData name="scrollVAp">Description</testData>
    <testData name="ScrollToPrice">Your contact information</testData>
    <testData name="newName">rahul sharma</testData>
    <testData name="kmDrivenMsp">5000-20000</testData>
    <testData name="AlertBrand">Chevrolet</testData>
    <testData name="city">Ahmedabad</testData>
    <testData name="inspectionreport">Overall Inspection Rating </testData>
    <testData name="off">OFF</testData>
    <testData name="bikeBrand">Bajaj</testData>
    <testData name="bikesModel">Discover 125</testData>
    <testData name="commercialVehicles">Commercial Vehicles</testData>
    <testData name="boat">Boat</testData>
    <testData name="invalidNumber">987</testData>
    <testData name="invalidEmail">guughuj</testData>
    <testData name="invalidNumberMessage">Enter 10 digit mobile number</testData>
    <testData name="invalidEmailMessage">Enter valid email Address</testData>
    <testData name="loginEmail">automation.quikr@gmail.com</testData>
    <testData name="loginPassword">quikr1234</testData>
    <testData name="GetQuotePrefixText">Buy insurance for just</testData>
    <testData name="bikes">Bikes</testData>
    <testData name="otherVehicle">Other Vehicles</testData>
    <testData name="commercialVehicle">Commercial Vehicles</testData>
    <testData name="vehicleType">Vehicle Type</testData>
    <testData name="GetViewNumberVap">View Number</testData>
    <testData name="freeText">ca</testData>
    <testData name="Boat">Boat</testData>
    <testData name="BrandForMsp">Suzuki</testData>
    <testData name="ModelForMSP">Bandit</testData>
    <testData name="FieroModelMsp">Fiero</testData>
    <testData name="getMspResultText">MSP Result</testData>
    <testData name="IamBuying">I'm Buying</testData>
    <testData name="IamSelling">I'm Selling</testData>
    <testData name="NewCarsText">Looking for a specific car?</testData>
    <testData name="AstonMartinTextContains">Aston Martin</testData>
</data>