<?xml version="1.0"?>
<data xmlns:xsi="http://www.w3.org/2001/XMLSchema-instance"
      xsi:noNamespaceSchemaLocation="../../../../../../../main/resources/TestData.xsd">

    <!--<testData name="city">bangalore</testData>-->
    <!--<testData name="cityUrl">bangalore</testData>-->
    <!--<testData name="loginEmail">automation.quikr@gmail.com</testData>-->
    <!--<testData name="loginpassword">quikr1234</testData>-->
    <!--<testData name="pap">post-classifieds-ads</testData>-->
    <!--<testData name="category">Home &#38; Lifestyle</testData>-->
    <!--<testData name="home-officefurniture">Home - Office Furniture</testData>-->
    <!--<testData name="adTitle">Test Ad For Automation</testData>-->
    <!--<testData name="price">100000</testData>-->
    <!--<testData name="reversePrice">100000</testData>-->
    <!--<testData name="reversePriceLess">90000</testData>-->
    <!--<testData name="adDescription">Test Description for Test Ad. This is Test Ad for Test Purpose. Posted using test automation</testData>-->
    <!--<testData name="name">Automation User</testData>-->
    <!--<testData name="adSuccessPage">/PostAd/?succeed</testData>-->
    <!--<testData name="searchQuery">Test ad for automation</testData>-->
    <!--<testData name="searchQuery1">Test test</testData>-->
    <!--<testData name="escrowMakeAnOfferPriceLess">80000</testData>-->
    <!--<testData name="escrowMakeAnOfferPriceMore">95000</testData>-->
    <!--<testData name="escrowMakeAnOfferEmail">automation.quikr@gmail.com</testData>-->
    <!--<testData name="escrowMakeAnOfferPhone">9966998855</testData>-->
    <!--<testData name="escrowPaymentPage">/escrowBuyer</testData>-->

    <testData name="categoryMobile">Mobiles &#38; Tablets</testData>
    <testData name="subCatMobile">Mobile Phones</testData>
    <testData name="categoryElectronic">Electronics &#38; Appliances</testData>
    <testData name="subCatElectronic">Laptops - Computers</testData>
    <testData name="categoryHome">Home &#38; Lifestyle</testData>
    <testData name="subCatHome">Home - Office Furniture</testData>
    <testData name="title">Title of an Automation script from Escrow</testData>
    <testData name="price">5000</testData>
    <testData name="minprice">4000</testData>
    <testData name="minpriceandpricesame">5000</testData>
    <testData name="yop">2015</testData>
    <testData name="mobileBrand">Sony</testData>
    <testData name="screenSize">14-14.9 inches</testData>
    <testData name="ramsize">6GB</testData>
    <testData name="furnituretype">Office Chair</testData>
    <testData name="OS">Blackberry</testData>
    <testData name="sims">Dual</testData>
    <testData name="includedItem">Data Cable</testData>
    <testData name="functionalCheck">None</testData>
    <testData name="description">Description of an Automation script from Escrow automation tests</testData>
    <testData name="sellerName">AutomationUser</testData>
    <testData name="sellerMail">web18@mail.quikrtest.com</testData>
    <testData name="sellerMobile">9900887766</testData>
    <testData name="sellerAddress">Some Address</testData>
    <testData name="sellerCity">Bangalore</testData>
    <testData name="sellerLocality">Agaram</testData>
    <testData name="sellerPincode">560001</testData>
    <testData name="counterPrice">4700</testData>
    <testData name="buyerName">WebTwenty</testData>
    <testData name="buyerMail">web20@mail.quikrtest.com</testData>
    <testData name="buyerPassword">quikr123</testData>
    <testData name="buyerMobile">9800987676</testData>
    <testData name="buyerCity">Bangalore</testData>
    <testData name="buyerAddress">Thanisandra</testData>
    <testData name="buyerPincode">560077</testData>
    <testData name="priceMAO">4500</testData>
    <testData name="searchBrandName">Apple</testData>

    <testData name="cardType">debit</testData>
    <!--testData name="cardNo">4012001037141112</testData-->
    <testData name="cardNo">5555555555554444</testData>
    <testData name="expiryDate">72020</testData>
    <testData name="cvv">123</testData>

    <testData name="sellerNameProd">ProdSeller</testData>
    <testData name="sellerMailProd">qkrseller@gmail.com</testData>
    <testData name="sellerMobileProd">9972199782</testData>
    <testData name="sellerAddressProd">Seller Address</testData>
    <testData name="sellerCityProd">Bangalore</testData>
    <testData name="sellerLocalityProd">Electronics City</testData>
    <testData name="sellerPincodeProd">560100</testData>
    <testData name="counterPriceProd">4700</testData>
    <testData name="buyerNameProd">ProdBuyer</testData>
    <testData name="buyerMailProd">qkrbuyer@gmail.com</testData>
    <testData name="buyerMobileProd">9972198681</testData>
    <testData name="buyerCityProd">Bangalore</testData>
    <testData name="priceMAOElect">9000</testData>
    <testData name="priceMAOElect1">10000</testData>
    <testData name="priceMAOHome">3000</testData>
    <testData name="priceMAOHome1">4000</testData>
    <testData name="priceMAOMobile">6000</testData>
    <testData name="priceMAOMobile1">1000</testData>
    <testData name="counterPriceElect">10500</testData>
    <testData name="counterPriceHome">3500</testData>
    <testData name="counterPriceMobile">7000</testData>
    <testData name="counterPriceMobileLessThanOffer">3000</testData>
</data>