<data xmlns:xsi="http://www.w3.org/2001/XMLSchema-instance" xsi:noNamespaceSchemaLocation="../../../../../../../main/resources/TestData.xsd">
    <testData name="jobs">Jobs</testData>
    <testData name="fullTimeJobs">Full Time Jobs</testData>
    <testData name="adTitle">post an ad for offer ad or want ad</testData>
    <testData name="adDescription">to check that role field is display for job category</testData>
    <testData name="locality">80 Ft. Road</testData>
    <testData name="alertsAndRecommendation">Alerts and Recommended</testData>
    <testData name="adTitleForAdPost">Job looking for Architect Job In Bangalore</testData>
    <testData name="adDescriptionForAdPost">I am a civi engineer and Designer  and Looking for Job to settle my career</testData>
    <testData name="educationOptionName">Graduate</testData>
    <testData name="experienceOptionName">Less than 1 yr</testData>
    <testData name="currentSalaryOptionName">Rs. 2L - Rs. 5L</testData>
    <testData name="nameOfPerson">Akshay raj</testData>
    <testData name="mbNumber">9955198856</testData>
    <testData name="adType">Ad Type</testData>
    <testData name="city">Bangalore</testData>
    <testData name="selectRole">Select Role</testData>
    <testData name="selectRoleOptionName">A</testData>
    <testData name="carsAndBikes">Cars</testData>
    <testData name="email">akshayKumar112@gmail.com</testData>
    <testData name="wrongPhoneNo">899999999999</testData>
    <testData name="wrongEmail">abcdf</testData>
    <testData name="name">Mooinou</testData>
    <testData name="salary">0</testData>
    <testData name="inputText">Hi</testData>
    <testData name="NewCity">Delhi</testData>
    <testData name="recentlyViewed">Recently Viewed Ads</testData>
    <testData name="cat">Electronics</testData>
    <testData name="real">Real</testData>
    <testData name="MyAccount">My Account</testData>
    <testData name="RoleExp">3</testData>
    <testData name="languageKnown">English</testData>
    <testData name="educationNew">Graduate</testData>
    <testData name="JOBS">Jobs</testData>
    <testData name="role">Architect</testData>
    <testData name="newRole">BPO</testData>
    <testData name="inddustry">BFSI</testData>
    <testData name="domElementPostAdTextBOx">preFilledData</testData>
    <testData name="RoleField">Role</testData>
    <testData name="jobKeyDomElemnt">SnbJobKEy</testData>
    <testData name="jobVAlueDomelemnt">snbJobVAlue</testData>
    <testData name="jobsSnbHeaderDomElemnt">jobsCreateProfile</testData>
    <testData name="newestFirst">Newest First</testData>
    <testData name="createProfile">Create Free Profile</testData>
    <testData name="filters">Filters</testData>
</data>